,MeSH Unique ID,MeSH Heading,ScopeNote,MeSHBrowserLink
0,D008659,Metabolic Diseases,"Generic term for diseases caused by an abnormal metabolic process. It can be congenital due to inherited enzyme abnormality (METABOLISM, INBORN ERRORS) or acquired due to disease of an endocrine organ or failure of a metabolically important organ such as the liver. (Stedman, 26th ed)",https://meshb.nlm.nih.gov/record/ui?ui=D008659
1,D013312,"Stress, Physiological","The unfavorable effect of environmental factors (stressors) on the physiological functions of an organism. Prolonged unresolved physiological stress can affect HOMEOSTASIS of the organism, and may lead to damaging or pathological conditions.",https://meshb.nlm.nih.gov/record/ui?ui=D013312
2,D024821,Metabolic Syndrome,A cluster of symptoms that are risk factors for CARDIOVASCULAR DISEASES and TYPE 2 DIABETES MELLITUS. The major components of metabolic syndrome include ABDOMINAL OBESITY; atherogenic DYSLIPIDEMIA; HYPERTENSION; HYPERGLYCEMIA; INSULIN RESISTANCE; a proinflammatory state; and a prothrombotic (THROMBOSIS) state.,https://meshb.nlm.nih.gov/record/ui?ui=D024821
3,D008660,Metabolism,The chemical reactions in living organisms by which energy is provided for vital processes and activities and new material is assimilated.,https://meshb.nlm.nih.gov/record/ui?ui=D008660
4,D065767,"Activation, Metabolic",The conversion of an exogenous substance by a biological system resulting in the production on an active metabolite.,https://meshb.nlm.nih.gov/record/ui?ui=D065767
5,D015431,Weight Loss,Decrease in existing BODY WEIGHT.,https://meshb.nlm.nih.gov/record/ui?ui=D015431
